{
  "record_type": "enterprise_ai_diagnostic_master_record",
  "schema_version": "0.2",
  "record_id": "MASTER-SIM-CRM-OWNER-TRANSFER-001",
  "version": 1,
  "enterprise_id": "ENT-SIM-BIZOPS",
  "project_id": "PRJ-SIM-CRM-OWNER-TRANSFER-001",
  "project_identity": {
    "enterprise_display_name": "模拟业务运营企业",
    "project_name": "CRM客户归属交接流程诊断",
    "project_owner_role": "企业项目负责人",
    "created_at": "2026-08-16T16:30:00+08:00"
  },
  "current_stage": {
    "stage": "evidence_completion",
    "status": "blocked",
    "owner_role": "企业项目负责人",
    "updated_at": "2026-08-16T16:30:00+08:00",
    "stop_reason": "当前只有E5模拟材料，等待授权、脱敏且可读取的真实OA、Excel、CRM日志和真实员工确认。"
  },
  "research_coverage": [
    {
      "department_id": "DEPT-SALES",
      "role": "销售申请人",
      "process_id": "PROC-CRM-OWNER-TRANSFER",
      "priority": "P0",
      "planned_participants": 1,
      "status": "not_submitted",
      "gap": "已有E5模拟卡，缺真实员工本人确认。"
    },
    {
      "department_id": "DEPT-BIZOPS",
      "role": "业务运营执行人",
      "process_id": "PROC-CRM-OWNER-TRANSFER",
      "priority": "P0",
      "planned_participants": 1,
      "status": "not_submitted",
      "gap": "已有E5模拟卡，缺真实岗位确认和裁决材料。"
    },
    {
      "department_id": "DEPT-IT",
      "role": "CRM管理员",
      "process_id": "PROC-CRM-OWNER-TRANSFER",
      "priority": "P0",
      "planned_participants": 1,
      "status": "not_submitted",
      "gap": "已有E5模拟卡，缺真实导入、权限、锁定、日志和回执证据。"
    },
    {
      "department_id": "DEPT-SALES",
      "role": "销售负责人",
      "process_id": "PROC-CRM-OWNER-TRANSFER",
      "priority": "P1",
      "planned_participants": 1,
      "status": "not_submitted",
      "gap": "缺真实审批责任和高风险客户规则确认。"
    }
  ],
  "participant_tasks": [],
  "workflow_cards": [],
  "materials": [
    {
      "record_id": "SIM-ART-029",
      "record_type": "simulation_artifact",
      "version": 1,
      "lifecycle_status": "current",
      "enterprise_id": "ENT-SIM-BIZOPS",
      "project_id": "PRJ-SIM-CRM-OWNER-TRANSFER-001",
      "authorization_status": "not_required",
      "analysis_status": "analyzed",
      "process_id": "PROC-CRM-OWNER-TRANSFER",
      "evidence_level": "E5",
      "evidence_label": "AI假设，待验证",
      "upstream_records": [],
      "supersedes": null,
      "change_reason": "管理层启动访谈方案模拟",
      "storage_ref": "simulations/business-operations-crm-authorization/29-simulated-management-kickoff-interview-plan.md",
      "created_at": "2026-08-16T14:00:00+08:00",
      "created_by_role": "simulation_agent"
    },
    {
      "record_id": "SIM-ART-030",
      "record_type": "simulation_artifact",
      "version": 1,
      "lifecycle_status": "current",
      "enterprise_id": "ENT-SIM-BIZOPS",
      "project_id": "PRJ-SIM-CRM-OWNER-TRANSFER-001",
      "authorization_status": "not_required",
      "analysis_status": "analyzed",
      "process_id": "PROC-CRM-OWNER-TRANSFER",
      "evidence_level": "E5",
      "evidence_label": "AI假设，待验证",
      "upstream_records": ["SIM-ART-029@1"],
      "supersedes": null,
      "change_reason": "管理层启动访谈运行模拟",
      "storage_ref": "simulations/business-operations-crm-authorization/30-simulated-management-kickoff-interview-run.md",
      "created_at": "2026-08-16T14:10:00+08:00",
      "created_by_role": "simulation_agent"
    },
    {
      "record_id": "SIM-ART-031",
      "record_type": "simulation_artifact",
      "version": 1,
      "lifecycle_status": "current",
      "enterprise_id": "ENT-SIM-BIZOPS",
      "project_id": "PRJ-SIM-CRM-OWNER-TRANSFER-001",
      "authorization_status": "not_required",
      "analysis_status": "analyzed",
      "process_id": "PROC-CRM-OWNER-TRANSFER",
      "evidence_level": "E5",
      "evidence_label": "AI假设，待验证",
      "upstream_records": ["SIM-ART-030@1"],
      "supersedes": null,
      "change_reason": "岗位流程摸排复跑模拟",
      "storage_ref": "simulations/business-operations-crm-authorization/31-simulated-workflow-mapping-after-kickoff.md",
      "created_at": "2026-08-16T14:20:00+08:00",
      "created_by_role": "simulation_agent"
    },
    {
      "record_id": "SIM-ART-032",
      "record_type": "simulation_artifact",
      "version": 1,
      "lifecycle_status": "current",
      "enterprise_id": "ENT-SIM-BIZOPS",
      "project_id": "PRJ-SIM-CRM-OWNER-TRANSFER-001",
      "authorization_status": "not_required",
      "analysis_status": "analyzed",
      "process_id": "PROC-CRM-OWNER-TRANSFER",
      "evidence_level": "E5",
      "evidence_label": "AI假设，待验证",
      "upstream_records": ["SIM-ART-031@1"],
      "supersedes": null,
      "change_reason": "归属交接模拟材料证据包",
      "storage_ref": "simulations/business-operations-crm-authorization/32-process-b-simulated-material-evidence-pack.md",
      "created_at": "2026-08-16T14:30:00+08:00",
      "created_by_role": "simulation_agent"
    },
    {
      "record_id": "SIM-ART-033",
      "record_type": "simulation_artifact",
      "version": 1,
      "lifecycle_status": "current",
      "enterprise_id": "ENT-SIM-BIZOPS",
      "project_id": "PRJ-SIM-CRM-OWNER-TRANSFER-001",
      "authorization_status": "not_required",
      "analysis_status": "analyzed",
      "process_id": "PROC-CRM-OWNER-TRANSFER",
      "evidence_level": "E5",
      "evidence_label": "AI假设，待验证",
      "upstream_records": ["SIM-ART-032@1"],
      "supersedes": null,
      "change_reason": "诊断门阻断模拟",
      "storage_ref": "simulations/business-operations-crm-authorization/33-process-b-simulated-diagnosis-gate-blocked.md",
      "created_at": "2026-08-16T14:40:00+08:00",
      "created_by_role": "simulation_agent"
    },
    {
      "record_id": "SIM-ART-034",
      "record_type": "simulation_artifact",
      "version": 1,
      "lifecycle_status": "current",
      "enterprise_id": "ENT-SIM-BIZOPS",
      "project_id": "PRJ-SIM-CRM-OWNER-TRANSFER-001",
      "authorization_status": "not_required",
      "analysis_status": "analyzed",
      "process_id": "PROC-CRM-OWNER-TRANSFER",
      "evidence_level": "E5",
      "evidence_label": "AI假设，待验证",
      "upstream_records": ["SIM-ART-033@1"],
      "supersedes": null,
      "change_reason": "诊断门控制夹具状态测试",
      "storage_ref": "simulations/business-operations-crm-authorization/34-simulated-diagnosis-gate-transition-test.md",
      "created_at": "2026-08-16T14:50:00+08:00",
      "created_by_role": "simulation_agent"
    },
    {
      "record_id": "SIM-ART-035",
      "record_type": "simulation_artifact",
      "version": 1,
      "lifecycle_status": "current",
      "enterprise_id": "ENT-SIM-BIZOPS",
      "project_id": "PRJ-SIM-CRM-OWNER-TRANSFER-001",
      "authorization_status": "not_required",
      "analysis_status": "analyzed",
      "process_id": "PROC-CRM-OWNER-TRANSFER",
      "evidence_level": "E5",
      "evidence_label": "AI假设，待验证",
      "upstream_records": ["SIM-ART-034@1"],
      "supersedes": null,
      "change_reason": "五天离线影子试点模拟",
      "storage_ref": "simulations/business-operations-crm-authorization/35-simulated-offline-shadow-pilot-run.md",
      "created_at": "2026-08-16T15:00:00+08:00",
      "created_by_role": "simulation_agent"
    },
    {
      "record_id": "SIM-ART-036",
      "record_type": "simulation_artifact",
      "version": 1,
      "lifecycle_status": "current",
      "enterprise_id": "ENT-SIM-BIZOPS",
      "project_id": "PRJ-SIM-CRM-OWNER-TRANSFER-001",
      "authorization_status": "not_required",
      "analysis_status": "analyzed",
      "process_id": "PROC-CRM-OWNER-TRANSFER",
      "evidence_level": "E5",
      "evidence_label": "AI假设，待验证",
      "upstream_records": ["SIM-ART-035@1"],
      "supersedes": null,
      "change_reason": "真实证据接收清单",
      "storage_ref": "simulations/business-operations-crm-authorization/36-real-evidence-intake-checklist.md",
      "created_at": "2026-08-16T15:10:00+08:00",
      "created_by_role": "simulation_agent"
    },
    {
      "record_id": "SIM-ART-037",
      "record_type": "simulation_artifact",
      "version": 1,
      "lifecycle_status": "current",
      "enterprise_id": "ENT-SIM-BIZOPS",
      "project_id": "PRJ-SIM-CRM-OWNER-TRANSFER-001",
      "authorization_status": "not_required",
      "analysis_status": "analyzed",
      "process_id": "PROC-CRM-OWNER-TRANSFER",
      "evidence_level": "E5",
      "evidence_label": "AI假设，待验证",
      "upstream_records": ["SIM-ART-036@1"],
      "supersedes": null,
      "change_reason": "材料阻断事件测试",
      "storage_ref": "simulations/business-operations-crm-authorization/37-owner-transfer-material-blocked-event.json",
      "created_at": "2026-08-16T16:00:00+08:00",
      "created_by_role": "simulation_agent"
    },
    {
      "record_id": "SIM-ART-038",
      "record_type": "simulation_artifact",
      "version": 1,
      "lifecycle_status": "current",
      "enterprise_id": "ENT-SIM-BIZOPS",
      "project_id": "PRJ-SIM-CRM-OWNER-TRANSFER-001",
      "authorization_status": "not_required",
      "analysis_status": "analyzed",
      "process_id": "PROC-CRM-OWNER-TRANSFER",
      "evidence_level": "E5",
      "evidence_label": "AI假设，待验证",
      "upstream_records": ["SIM-ART-037@1"],
      "supersedes": null,
      "change_reason": "等待真实证据调度结果",
      "storage_ref": "simulations/business-operations-crm-authorization/38-owner-transfer-waiting-for-evidence-routing.json",
      "created_at": "2026-08-16T16:10:00+08:00",
      "created_by_role": "simulation_agent"
    }
  ],
  "conflicts_and_evidence_requests": [],
  "organizational_confirmations": [],
  "stops_and_recoveries": [],
  "diagnoses_and_pilots": [],
  "output_views": []
}
