{
  "record_type": "enterprise_ai_diagnostic_master_record",
  "schema_version": "0.2",
  "record_id": "MASTER-SIM-RTL-V02",
  "version": 1,
  "enterprise_id": "ENT-SIM-RTL",
  "project_id": "PRJ-SIM-RTL-V02",
  "project_identity": {
    "enterprise_display_name": "模拟连锁零售企业",
    "project_name": "门店客诉流程诊断v0.2",
    "project_owner_role": "企业运营负责人",
    "created_at": "2026-08-14T09:00:00+08:00"
  },
  "current_stage": {
    "stage": "diagnosis",
    "status": "active",
    "owner_role": "企业项目负责人",
    "updated_at": "2026-08-14T15:00:00+08:00",
    "stop_reason": null
  },
  "research_coverage": [
    {"department_id": "DEPT-STORE", "role": "门店客服", "process_id": "PROC-COMPLAINT", "priority": "P0", "planned_participants": 1, "status": "analyzed", "gap": ""},
    {"department_id": "DEPT-STORE", "role": "店长", "process_id": "PROC-COMPLAINT", "priority": "P0", "planned_participants": 1, "status": "analyzed", "gap": ""},
    {"department_id": "DEPT-QUALITY", "role": "总部品控", "process_id": "PROC-COMPLAINT", "priority": "P1", "planned_participants": 1, "status": "declined", "gap": "本轮不阻断诊断，管理层视图保留缺口"}
  ],
  "participant_tasks": [
    {"task_id": "TASK-CSR-001", "participant_id": "PART-CSR-001", "department_id": "DEPT-STORE", "role": "门店客服", "process_id": "PROC-COMPLAINT", "priority": "P0", "status": "completed", "current_workflow_card": "CARD-CSR-001@1", "updated_at": "2026-08-14T11:00:00+08:00", "updated_by_role": "employee", "status_reason": "员工确认且关键异常已关闭"},
    {"task_id": "TASK-MGR-001", "participant_id": "PART-MGR-001", "department_id": "DEPT-STORE", "role": "店长", "process_id": "PROC-COMPLAINT", "priority": "P0", "status": "completed", "current_workflow_card": "CARD-MGR-001@1", "updated_at": "2026-08-14T11:20:00+08:00", "updated_by_role": "store_manager", "status_reason": "流程负责人确认且H2已形成组织决定"},
    {"task_id": "TASK-QA-001", "participant_id": "PART-QA-001", "department_id": "DEPT-QUALITY", "role": "总部品控", "process_id": "PROC-COMPLAINT", "priority": "P1", "status": "participant_declined", "updated_at": "2026-08-14T11:30:00+08:00", "updated_by_role": "project_owner", "status_reason": "员工拒绝参与，本轮作为非阻断缺口"}
  ],
  "workflow_cards": [
    {"record_id": "CARD-CSR-001", "record_type": "workflow_card", "version": 1, "lifecycle_status": "current", "enterprise_id": "ENT-SIM-RTL", "project_id": "PRJ-SIM-RTL-V02", "participant_id": "PART-CSR-001", "process_id": "PROC-COMPLAINT", "employee_confirmed": true, "confirmed_at": "2026-08-14T10:30:00+08:00", "authorization_status": "authorized", "evidence_level": "E3", "upstream_records": [], "supersedes": null, "change_reason": "员工本人确认", "storage_ref": "simulations/routing-v0.2/card-csr.md", "created_at": "2026-08-14T10:30:00+08:00", "created_by_role": "employee"},
    {"record_id": "CARD-MGR-001", "record_type": "workflow_card", "version": 1, "lifecycle_status": "current", "enterprise_id": "ENT-SIM-RTL", "project_id": "PRJ-SIM-RTL-V02", "participant_id": "PART-MGR-001", "process_id": "PROC-COMPLAINT", "employee_confirmed": true, "confirmed_at": "2026-08-14T10:40:00+08:00", "authorization_status": "authorized", "evidence_level": "E3", "upstream_records": [], "supersedes": null, "change_reason": "店长确认", "storage_ref": "simulations/routing-v0.2/card-manager.md", "created_at": "2026-08-14T10:40:00+08:00", "created_by_role": "store_manager"}
  ],
  "materials": [
    {"record_id": "MAT-SOP-001", "record_type": "sop", "version": 1, "lifecycle_status": "current", "enterprise_id": "ENT-SIM-RTL", "project_id": "PRJ-SIM-RTL-V02", "authorization_status": "authorized", "analysis_status": "analyzed", "content_hash": "aaaaaaaaaaaaaaaaaaaaaaaaaaaaaaaaaaaaaaaaaaaaaaaaaaaaaaaaaaaaaaaa", "evidence_level": "E4", "upstream_records": [], "supersedes": null, "change_reason": "现行客诉制度", "storage_ref": "simulations/routing-v0.2/complaint-sop.pdf", "created_at": "2026-08-14T09:30:00+08:00", "created_by_role": "enterprise_owner"},
    {"record_id": "MAT-TICKET-001", "record_type": "ticket_sample", "version": 1, "lifecycle_status": "current", "enterprise_id": "ENT-SIM-RTL", "project_id": "PRJ-SIM-RTL-V02", "authorization_status": "restricted", "analysis_status": "analyzed", "content_hash": "bbbbbbbbbbbbbbbbbbbbbbbbbbbbbbbbbbbbbbbbbbbbbbbbbbbbbbbbbbbbbbbb", "evidence_level": "E1", "upstream_records": [], "supersedes": null, "change_reason": "脱敏工单样本", "storage_ref": "simulations/routing-v0.2/ticket-sample.xlsx", "created_at": "2026-08-14T10:00:00+08:00", "created_by_role": "employee"}
  ],
  "conflicts_and_evidence_requests": [
    {"record_id": "HYP-001", "record_type": "ai_hypothesis", "version": 1, "lifecycle_status": "current", "enterprise_id": "ENT-SIM-RTL", "project_id": "PRJ-SIM-RTL-V02", "authorization_status": "not_required", "evidence_level": "E5", "evidence_label": "AI假设，待验证", "upstream_records": ["CARD-CSR-001@1", "MAT-TICKET-001@1"], "supersedes": null, "change_reason": "晚补录可能延迟风险识别", "storage_ref": "simulations/routing-v0.2/evidence-pack.md", "created_at": "2026-08-14T12:00:00+08:00", "created_by_role": "agent"},
    {"record_id": "X-H2-001", "record_type": "evidence_conflict", "version": 1, "lifecycle_status": "current", "enterprise_id": "ENT-SIM-RTL", "project_id": "PRJ-SIM-RTL-V02", "authorization_status": "not_required", "evidence_level": "E2", "upstream_records": ["CARD-CSR-001@1", "CARD-MGR-001@1"], "supersedes": null, "change_reason": "店长接管责任口径冲突", "storage_ref": "simulations/routing-v0.2/evidence-pack.md", "created_at": "2026-08-14T12:10:00+08:00", "created_by_role": "material_analyst", "resolved_by_confirmation_record": "CONFIRM-H2-001@1"},
    {"record_id": "GAP-QA-001", "record_type": "evidence_request", "version": 1, "lifecycle_status": "current", "enterprise_id": "ENT-SIM-RTL", "project_id": "PRJ-SIM-RTL-V02", "authorization_status": "not_required", "evidence_level": "E3", "upstream_records": [], "supersedes": null, "change_reason": "总部品控拒绝参与，缺高风险接收旁证", "storage_ref": "simulations/routing-v0.2/evidence-pack.md", "created_at": "2026-08-14T12:20:00+08:00", "created_by_role": "project_owner"},
    {"record_id": "EVIDENCE-V02-001", "record_type": "enterprise_material_evidence_pack", "version": 1, "lifecycle_status": "current", "enterprise_id": "ENT-SIM-RTL", "project_id": "PRJ-SIM-RTL-V02", "authorization_status": "authorized", "evidence_level": "E2", "upstream_records": ["CARD-CSR-001@1", "CARD-MGR-001@1", "MAT-SOP-001@1", "MAT-TICKET-001@1", "HYP-001@1", "X-H2-001@1", "GAP-QA-001@1"], "supersedes": null, "change_reason": "v0.2诊断证据包", "storage_ref": "simulations/routing-v0.2/evidence-pack.md", "created_at": "2026-08-14T12:30:00+08:00", "created_by_role": "material_analyst"}
  ],
  "organizational_confirmations": [
    {"record_id": "CONFIRM-H2-001", "record_type": "organizational_confirmation", "version": 1, "lifecycle_status": "current", "enterprise_id": "ENT-SIM-RTL", "project_id": "PRJ-SIM-RTL-V02", "authorization_status": "not_required", "decision_class": "organization_decision", "source_evidence_level": "E3", "authority_basis": "企业运营负责人负责客诉升级规则", "applicable_scope": "本项目试点门店未来客诉接管", "effective_at": "2026-08-15T00:00:00+08:00", "upstream_records": ["CARD-CSR-001@1", "CARD-MGR-001@1"], "supersedes": null, "change_reason": "明确未来采用的店长接管口径，不改写历史事实", "storage_ref": "simulations/routing-v0.2/h2-confirmation.md", "created_at": "2026-08-14T13:00:00+08:00", "created_by_role": "enterprise_owner"}
  ],
  "stops_and_recoveries": [
    {"stop_id": "STOP-001", "status": "recovered", "reason": "工单样本授权曾短暂撤回", "affected_records": ["MAT-TICKET-001@1", "EVIDENCE-V02-001@1"], "recovery_conditions": ["重新确认脱敏材料授权", "复核下游引用"], "created_at": "2026-08-14T13:10:00+08:00", "created_by_role": "project_owner", "manual_recovery": true, "recovered_at": "2026-08-14T13:30:00+08:00", "recovered_by_role": "project_owner", "recovery_basis": "授权方书面确认并完成引用复核", "resume_stage": "evidence_completion"}
  ],
  "diagnoses_and_pilots": [
    {"record_id": "DIAG-V02-001", "record_type": "process_diagnosis", "version": 1, "lifecycle_status": "current", "review_status": "approved", "enterprise_id": "ENT-SIM-RTL", "project_id": "PRJ-SIM-RTL-V02", "authorization_status": "authorized", "evidence_level": "E2", "outstanding_gaps": ["GAP-QA-001@1"], "upstream_records": ["EVIDENCE-V02-001@1", "CONFIRM-H2-001@1"], "supersedes": null, "change_reason": "关键P0覆盖完成后形成条件式诊断", "storage_ref": "simulations/routing-v0.2/diagnosis.md", "created_at": "2026-08-14T14:00:00+08:00", "created_by_role": "transformation_practitioner"}
  ],
  "output_views": [
    {"view_id": "VIEW-LEADER-V02", "audience_role": "enterprise_leader", "publication_status": "published", "source_records": ["DIAG-V02-001@1"], "allowed_sections": ["coverage", "findings", "risks", "decisions"], "excluded_sections": ["raw_employee_materials", "restricted_management_notes"], "metadata_policy": "preserve_source_metadata"}
  ]
}
